conceptId,descendantCount,snomedConcept,snomedIdentifier,term
721763002,3.0,Inflammation of intestine caused by Norovirus (disorder),445152004,Infection caused by Norovirus (disorder)
78420004,23.0,Inflammation of intestine caused by Norovirus (disorder),445152004,Viral enteritis (disorder)
128999004,957.0,Inflammatory bowel disease (disorder),24526004,Inflammatory disorder of digestive tract (disorder)
363169009,6848.0,Inflammatory bowel disease (disorder),24526004,Inflammation of specific body organs (disorder)
85919009,2124.0,Inflammatory bowel disease (disorder),24526004,Disorder of intestine (disorder)
373407002,1248.0,Inflammatory disease of liver (disorder),128241005,Inflammatory disorder of digestive system (disorder)
363169009,6848.0,Inflammatory disease of liver (disorder),128241005,Inflammation of specific body organs (disorder)
235856003,598.0,Inflammatory disease of liver (disorder),128241005,Disorder of liver (disorder)
95351003,1003.0,Inflammatory disease of mucous membrane (disorder),95361005,Disorder of mucous membrane (disorder)
363171009,7814.0,Inflammatory disease of mucous membrane (disorder),95361005,Inflammation of specific body systems (disorder)
269859006,135.0,Inflammatory disorder due to increased blood urate level (disorder),90560007,Blood urate raised (finding)
32612005,165.0,Inflammatory disorder due to increased blood urate level (disorder),90560007,Disorder of purine metabolism (disorder)
65093003,45.0,Influenza (disorder),6142004,Disease caused by Orthomyxoviridae (disorder)
312133006,111.0,Influenza (disorder),6142004,Viral respiratory infection (disorder)
442438000,11.0,Influenza caused by Influenza A virus subtype H1N1 (disorder),442696006,Influenza caused by Influenza A virus (disorder)
128619003,541.0,Ingrowing toenail (disorder),400200009,Disorder of toe (disorder)
400097005,8.0,Ingrowing toenail (disorder),400200009,Ingrowing nail (disorder)
249593009,66.0,Inguinal hernia (disorder),396232000,Inguinal canal finding (finding)
128545000,174.0,Inguinal hernia (disorder),396232000,Hernia of abdominal wall (disorder)
118936007,211.0,Inguinal hernia (disorder),396232000,Disorder of inguinal region (disorder)
363186003,1688.0,Inhaled steroid therapy (procedure),710818004,Introduction of substance by body site (procedure)
297279009,12.0,Inhaled steroid therapy (procedure),710818004,Steroid therapy (procedure)
433590000,159.0,Inhaled steroid therapy (procedure),710818004,Administration of substance via specific route (procedure)
118669005,2052.0,Inhaled steroid therapy (procedure),710818004,Procedure on respiratory system (procedure)
281706009,1140.0,Injection of steroid (procedure),296778005,Injection of substance (procedure)
400209005,361.0,Injury caused by low temperature (disorder),726523002,Injury caused by causative force (disorder)
241967006,61.0,Injury caused by low temperature (disorder),726523002,General effects of low temperature (disorder)
444158007,10.0,Injury of anterior cruciate ligament (disorder),444470001,Injury of cruciate ligament of knee (disorder)
127278005,2458.0,Injury of brachial plexus (disorder),6836001,Injury of upper extremity (disorder)
3548001,48.0,Injury of brachial plexus (disorder),6836001,Brachial plexus disorder (disorder)
609395005,28.0,Injury of brachial plexus (disorder),6836001,Injury of somatic nerve plexus (disorder)
385424001,954.0,Injury of cartilage (disorder),363182001,Injury of connective tissue (disorder)
50927007,513.0,Injury of cartilage (disorder),363182001,Cartilage disorder (disorder)
105606008,3576.0,Injury of cartilage (disorder),363182001,Injury of musculoskeletal system (disorder)
82271004,2125.0,Injury of eye region (disorder),282752000,Injury of head (disorder)
371409005,5130.0,Injury of eye region (disorder),282752000,Disorder of eye region (disorder)
897601009,2660.0,Injury of head (disorder),82271004,Injury of head and/or neck (disorder)
118934005,15505.0,Injury of head (disorder),82271004,Disorder of head (disorder)
57182000,401.0,Injury of peripheral nerve (disorder),73590005,Nerve injury (disorder)
282026002,3848.0,Injury of peripheral nerve (disorder),73590005,Soft tissue injury (disorder)
302226006,1109.0,Injury of peripheral nerve (disorder),73590005,Peripheral nerve disease (disorder)
444158007,10.0,Injury of posterior cruciate ligament (disorder),433162006,Injury of cruciate ligament of knee (disorder)
105606008,3576.0,Injury of rotator cuff (disorder),718539004,Injury of musculoskeletal system (disorder)
125594001,349.0,Injury of rotator cuff (disorder),718539004,Injury of shoulder region (disorder)
414033006,41.0,Injury of rotator cuff (disorder),718539004,Disorder of rotator cuff (disorder)
242056005,335.0,Injury while engaged in sports activity (disorder),443786003,Accidental injury (disorder)
371058004,13.0,Insect sting (disorder),299971005,Venomous sting (disorder)
194437008,34.0,Insomnia (disorder),193462001,Disorders of initiating and maintaining sleep (disorder)
44186003,84.0,Insomnia (disorder),193462001,Dyssomnia (disorder)
224884006,154.0,Intensive care unit (environment),309904001,Location within hospital premises (environment)
762452003,28.0,Intermittent claudication (finding),63491006,Chronic musculoskeletal pain (finding)
427935006,10.0,Intermittent claudication (finding),63491006,Pain relief by rest (finding)
427341007,10.0,Intermittent claudication (finding),63491006,Pain provoked by exertion (finding)
314642004,21.0,Intermittent claudication (finding),63491006,Intermittent pain (finding)
68962001,44.0,Intermittent claudication (finding),63491006,Muscle pain (finding)
191765005,5.0,Intermittent explosive disorder (disorder),40987004,Emotionally unstable personality disorder (disorder)
128293007,95.0,Intermittent explosive disorder (disorder),40987004,Chronic mental disorder (disorder)
66347000,16.0,Intermittent explosive disorder (disorder),40987004,Impulse control disorder (disorder)
19829001,1148.0,Interstitial lung disease (disorder),233703007,Disorder of lung (disorder)
363044007,952.0,Interstitial lung disease (disorder),233703007,Connective tissue disorder by body site (disorder)
36427004,95.0,Intervertebral disc prolapse (disorder),73589001,Intervertebral disc disorder (disorder)
85919009,2124.0,Intestinal obstruction (disorder),81060008,Disorder of intestine (disorder)
126765001,159.0,Intestinal obstruction (disorder),81060008,Gastrointestinal obstruction (disorder)
75478009,3615.0,Intoxication with Clostridium botulinum toxin (disorder),414531002,Poisoning (disorder)
301432000,68.0,Intracranial aneurysm (disorder),128609009,Aneurysm of head and neck artery (disorder)
250845006,258.0,Intracranial aneurysm (disorder),128609009,Intracerebral vascular finding (finding)
118934005,15505.0,Intracranial aneurysm (disorder),128609009,Disorder of head (disorder)
62914000,542.0,Intracranial aneurysm (disorder),128609009,Cerebrovascular disease (disorder)
85974009,346.0,Intracranial hematoma (disorder),450425005,Mass of intracranial structure (finding)
385494008,242.0,Intracranial hematoma (disorder),450425005,Hematoma (disorder)
1386000,191.0,Intracranial hematoma (disorder),450425005,Intracranial hemorrhage (disorder)
23853001,4992.0,Intracranial hypotension (disorder),433691000124104,Disorder of the central nervous system (disorder)
126631009,1838.0,Intracranial tumor (disorder),254935002,Neoplasm of head (disorder)
85974009,346.0,Intracranial tumor (disorder),254935002,Mass of intracranial structure (finding)
236893003,12.0,Intrauterine artificial insemination (procedure),265064001,Introduction of substance - uterine cavity (procedure)
58533008,13.0,Intrauterine artificial insemination (procedure),265064001,Artificial insemination (procedure)
708041002,663.0,Invagination (morphologic abnormality),41444002,Mechanical lesion (morphologic abnormality)
410692006,96.0,Iritis (disorder),65074000,Anterior uveitis (disorder)
85478004,216.0,Iritis (disorder),65074000,Disorder of iris (disorder)
66612000,54.0,Iron deficiency anemia (disorder),87522002,Nutritional anemia (disorder)
363246002,130.0,Iron deficiency anemia (disorder),87522002,Nutritional deficiency associated condition (disorder)
81120009,77.0,Irritable bowel syndrome (disorder),10743008,Functional disorder of intestine (disorder)
119523007,866.0,Irritable bowel syndrome (disorder),10743008,Disorder of large intestine (disorder)
239997002,1.0,Irritable hip (disorder),301813003,Lesion of joint capsule of pelvic region (disorder)
280136002,1503.0,Irritable hip (disorder),301813003,Disorder of soft tissue of lower limb (disorder)
3519007,215.0,Irritable hip (disorder),301813003,Disorder of synovium (disorder)
128524007,407.0,Ischemic colitis (disorder),30588004,Disorder of colon (disorder)
20484008,16.0,Jakob-Creutzfeldt disease (disorder),792004,Prion disease (disorder)
34476008,71.0,Japanese encephalitis virus disease (disorder),52947006,Viral encephalitis (disorder)
111865007,54.0,Japanese encephalitis virus disease (disorder),52947006,Disease caused by Flavivirus (disorder)
419289009,21.0,Jellyfish sting (event),274920002,Sting by animal (event)
387605007,9.0,Jet lag (finding),387604006,Abnormal chronobiologic state (finding)
298249004,113.0,Joint pain (finding),57676002,Finding of sensation of joint (finding)
279069000,171.0,Joint pain (finding),57676002,Musculoskeletal pain (finding)
342291000119102,4.0,Juvenile cataract (disorder),399336001,Infantile and/or juvenile cataract (disorder)
355208009,18.0,Juvenile osteochondrosis of tibial tubercle (disorder),72047008,Juvenile osteochondrosis of lower extremity (disorder)
128137003,699.0,Juvenile osteochondrosis of tibial tubercle (disorder),72047008,Disorder of lower leg (disorder)
363346000,4337.0,Kaposi's sarcoma (disorder),109385007,Malignant neoplastic disease (disorder)
41478008,26.0,Keratoconus (disorder),65636009,Corneal deformity (disorder)
238625005,19.0,Keratosis pilaris (disorder),5132005,Follicular keratosis (disorder)
444780001,18.0,Ketoacidosis in diabetes mellitus (disorder),420422005,Glucose in blood specimen above reference range (finding)
56051008,10.0,Ketoacidosis in diabetes mellitus (disorder),420422005,Ketoacidosis (disorder)
735539005,11.0,Ketoacidosis in diabetes mellitus (disorder),420422005,Metabolic acidosis due to diabetes mellitus (disorder)
95566004,42.0,Kidney stone (disorder),95570007,Urolithiasis (disorder)
90708001,1209.0,Kidney stone (disorder),95570007,Kidney disease (disorder)
79131000119100,298.0,Kidney stone (disorder),95570007,Kidney lesion (finding)
312104005,3.0,Klatskin's tumor (disorder),253017000,Cholangiocarcinoma of biliary tract (disorder)
187784000,3.0,Klatskin's tumor (disorder),253017000,Malignant neoplasm of hepatic duct (disorder)
66347000,16.0,Kleptomania (disorder),69361009,Impulse control disorder (disorder)
111312006,51.0,Klinefelter syndrome (disorder),22053006,Anomaly of chromosome X (disorder)
254284003,12.0,Klinefelter syndrome (disorder),22053006,Sex chromosome abnormality - male phenotype (disorder)
416377005,6.0,Klippel Trenaunay syndrome (disorder),721105004,Port-wine stain of skin (disorder)
723991007,2.0,Klippel Trenaunay syndrome (disorder),721105004,Angio-osteohypertrophic syndrome (disorder)
299328006,27.0,Knee joint valgus deformity (finding),299330008,Deformity of knee joint (finding)
609381007,110.0,Knee joint valgus deformity (finding),299330008,Angulation deformity of lower limb (finding)
238107002,24.0,Kwashiorkor (disorder),58262005,Deficiency of macronutrients (disorder)
928000,11280.0,Kyphosis deformity of spine (disorder),414564002,Disorder of musculoskeletal system (disorder)
64217002,79.0,Kyphosis deformity of spine (disorder),414564002,Curvature of spine (disorder)
699699005,1370.0,Kyphosis deformity of spine (disorder),414564002,Disorder of vertebral column (disorder)
237972006,21.0,Lactase deficiency (disorder),237975008,Disorder of carbohydrate absorption (disorder)
108191006,251.0,Laparoscopy (procedure),73632009,Abdomen endoscopy (procedure)
363169009,6848.0,Laryngitis (disorder),45913009,Inflammation of specific body organs (disorder)
129134004,322.0,Laryngitis (disorder),45913009,Inflammatory disorder of upper respiratory tract (disorder)
60600009,483.0,Laryngitis (disorder),45913009,Disorder of the larynx (disorder)
300526001,22.0,Late ejaculation (finding),15405008,Finding of ejaculation (finding)
24570008,74.0,Laxative (substance),372800002,Cathartic (substance)
118235002,7174.0,Lazy eye (finding),246623008,Eye / vision finding (finding)
266249003,18.0,Left ventricular hypertrophy (disorder),55827005,Ventricular hypertrophy (disorder)
253535002,134.0,Left ventricular hypertrophy (disorder),55827005,Left ventricular abnormality (disorder)
26726000,9.0,Legionella pneumonia (disorder),195889001,Legionella infection (disorder)
409665004,13.0,Legionella pneumonia (disorder),195889001,Pneumonia caused by aerobic bacteria (disorder)
430395005,41.0,Legionella pneumonia (disorder),195889001,Pneumonia caused by Gram negative bacteria (disorder)
767811005,1517.0,Lesion of eyelid (finding),301913002,Lesion of face (finding)
246812007,868.0,Lesion of eyelid (finding),301913002,Eyelid finding (finding)
414823004,593.0,"Leukemia, disease (disorder)",93143009,Neoplasm affecting hematopoietic structure (disorder)
269475001,660.0,"Leukemia, disease (disorder)",93143009,"Malignant tumor of lymphoid, hemopoietic AND/OR related tissue (disorder)"
372087000,2231.0,"Leukemia, disease (disorder)",93143009,Primary malignant neoplasm (disorder)
95351003,1003.0,Leukoplakia (disorder),274134003,Disorder of mucous membrane (disorder)
95355007,53.0,Leukoplakia (disorder),274134003,Mucous membrane hyperplasia (finding)
254666005,435.0,Leukoplakia (disorder),274134003,Keratosis (disorder)
276320009,514.0,Leukoplakia (disorder),274134003,Lesion of mucosa (finding)
26996000,23.0,Leukoplakia (morphologic abnormality),50978000,Hyperkeratosis (morphologic abnormality)
83577005,6.0,Leukoplakia (morphologic abnormality),50978000,Squamous metaplasia (morphologic abnormality)
88996004,86.0,Lichen nitidus (disorder),41890004,Lichen (disorder)
271757001,84.0,Lichen nitidus (disorder),41890004,Papular eruption (disorder)
271757001,84.0,Lichen planus (disorder),4776004,Papular eruption (disorder)
88996004,86.0,Lichen planus (disorder),4776004,Lichen (disorder)
128294001,665.0,Lichen sclerosus (disorder),895454001,Chronic inflammatory disorder (disorder)
363171009,7814.0,Lichen sclerosus (disorder),895454001,Inflammation of specific body systems (disorder)
714974000,4962.0,Lichen sclerosus (disorder),895454001,Lesion of skin and/or skin-associated mucous membrane (finding)
254666005,435.0,Lichen sclerosus (disorder),895454001,Keratosis (disorder)
213299007,34.0,Limb stump pain (finding),247381009,Postoperative pain (finding)
90834002,217.0,Limb stump pain (finding),247381009,Pain in limb (finding)
89155008,18.0,Limited systemic sclerosis (disorder),299276009,Systemic sclerosis (disorder)
16973004,3.0,Limp occurring during childhood (finding),88121000119101,Limping (finding)
118654009,485.0,Lipedema (disorder),234102003,Disorder characterized by edema (disorder)
126487009,112.0,Lipedema (disorder),234102003,Subcutaneous fat disorder (disorder)
254830006,103.0,Lipoma (disorder),93163002,Benign lipomatous tumor (disorder)
721739005,17.0,Listeriosis (disorder),4241002,Infection caused by Listeria (disorder)
115218002,56.0,Lobular carcinoma in situ (morphologic abnormality),77284006,"Ductal, lobular AND/OR medullary neoplasm (morphologic abnormality)"
399919001,40.0,Lobular carcinoma in situ (morphologic abnormality),77284006,Carcinoma in situ - category (morphologic abnormality)
109888004,3.0,Lobular carcinoma in situ of left breast (disorder),354341000119108,Lobular carcinoma in situ of breast (disorder)
399097000,365.0,Local anesthesia (procedure),386761002,Administration of anesthesia (procedure)
254837009,136.0,Local recurrence of malignant tumor of breast (disorder),314955001,Malignant neoplasm of breast (disorder)
128529002,10.0,Local recurrence of malignant tumor of breast (disorder),314955001,Chronic disease of breast (disorder)
58184002,371.0,Local recurrence of malignant tumor of breast (disorder),314955001,Recurrent disease (disorder)
698271000,17.0,Long QT syndrome (disorder),9651007,Cardiac channelopathy (disorder)
106151004,17.0,Loss of sense of smell (finding),44169009,Finding of sense of smell (finding)
49601007,6980.0,Low blood pressure (disorder),45007003,Disorder of cardiovascular system (disorder)
118694006,15016.0,Lumbar puncture (procedure),277762005,Procedure on trunk (procedure)
85921004,161.0,Lumbar puncture (procedure),277762005,Puncture procedure (procedure)
118886002,118.0,Lumbar puncture (procedure),277762005,Procedure on spinal meninges (procedure)
105969002,2951.0,Lupus erythematosus (disorder),200936003,Disorder of connective tissue (disorder)
85828009,461.0,Lupus erythematosus (disorder),200936003,Autoimmune disease (disorder)
240668005,43.0,Lyme disease (disorder),23502006,Borreliosis (disorder)
362971004,858.0,Lymphadenopathy (disorder),30746006,Disorder of lymphatic system (disorder)
79654002,27.0,Lymphatic edema (morphologic abnormality),30213001,Edema (morphologic abnormality)
118654009,485.0,Lymphedema (disorder),234097001,Disorder characterized by edema (disorder)
11131000119108,3112.0,Macular hole (disorder),232006002,Anomaly of eye (disorder)
301905003,1531.0,Macular hole (disorder),232006002,Lesion of eye structure (finding)
312999006,159.0,Macular hole (disorder),232006002,Disorder of macula of retina (disorder)
363679005,6502.0,Magnetic resonance imaging (procedure),113091000,Imaging (procedure)
35489007,141.0,Major depressive disorder (disorder),370143000,Depressive disorder (disorder)
82271004,2125.0,Major head injury (disorder),314662007,Injury of head (disorder)
417746004,7653.0,Major head injury (disorder),314662007,Traumatic injury (disorder)
105649009,38.0,Malaria (disorder),61462000,Disease caused by Plasmodiidae (disorder)
48130008,88.0,Male hypogonadism (disorder),48723006,Hypogonadism (disorder)
64910008,233.0,Male hypogonadism (disorder),48723006,Disorder of testis (disorder)
409702008,4.0,Malignant hyperthermia (finding),405501007,Hyperpyrexia (finding)
363461003,61.0,Malignant melanoma of eye (disorder),274087000,Malignant tumor of eye (disorder)
269578002,58.0,Malignant melanoma of eye (disorder),274087000,Malignant melanoma of head and neck (disorder)
86049000,886.0,"Malignant melanoma, no International Classification of Diseases for Oncology subtype (morphologic abnormality)",2092003,"Malignant neoplasm, primary (morphologic abnormality)"
372156000,29.0,"Malignant melanoma, no International Classification of Diseases for Oncology subtype (morphologic abnormality)",2092003,Malignant melanoma - category (morphologic abnormality)
443679004,287.0,Malignant neoplasm of bone (disorder),428281000,Malignant neoplasm of skeletal system (disorder)
126537000,585.0,Malignant neoplasm of bone (disorder),428281000,Neoplasm of bone (disorder)
126926005,247.0,Malignant neoplasm of breast (disorder),254837009,Neoplasm of breast (disorder)
188361007,441.0,Malignant neoplasm of breast (disorder),254837009,Malignant neoplasm of thorax (disorder)
126838000,97.0,Malignant neoplasm of colon (disorder),363406005,Neoplasm of colon (disorder)
781382000,85.0,Malignant neoplasm of colon (disorder),363406005,Malignant neoplasm of colon and/or rectum (disorder)
126927001,105.0,Malignant neoplasm of female breast (disorder),372064008,Neoplasm of female breast (disorder)
254837009,136.0,Malignant neoplasm of female breast (disorder),372064008,Malignant neoplasm of breast (disorder)
126851005,42.0,Malignant neoplasm of liver (disorder),93870000,Neoplasm of liver (disorder)
255077007,692.0,Malignant neoplasm of liver (disorder),93870000,Malignant tumor of digestive organ (disorder)
448882009,720.0,Malignant neoplasm of liver (disorder),93870000,Malignant neoplasm of intraabdominal organ (disorder)
126937006,31.0,Malignant neoplasm of male breast (disorder),372095001,Neoplasm of male breast (disorder)
254837009,136.0,Malignant neoplasm of male breast (disorder),372095001,Malignant neoplasm of breast (disorder)
269469005,982.0,Malignant neoplasm of skin (disorder),372130007,Malignant neoplasm of soft tissue (disorder)
126488004,1133.0,Malignant neoplasm of skin (disorder),372130007,Neoplasm of skin (disorder)
126908007,212.0,Malignant neoplasm of uterus (disorder),371973000,Neoplasm of uterus (disorder)
363484005,453.0,Malignant neoplasm of uterus (disorder),371973000,Malignant tumor of pelvis (disorder)
448882009,720.0,Malignant neoplasm of uterus (disorder),371973000,Malignant neoplasm of intraabdominal organ (disorder)
363514001,226.0,Malignant neoplasm of uterus (disorder),371973000,Malignant tumor of female genital organ (disorder)
367651003,1006.0,"Malignant neoplasm, primary (morphologic abnormality)",86049000,"Malignant neoplasm of primary, secondary, or uncertain origin (morphologic abnormality)"
55342001,8239.0,Malignant neoplastic disease (disorder),363346000,Neoplastic disease (disorder)
363490009,26.0,Malignant tumor of anal canal (disorder),363352004,Malignant tumor of anus (disorder)
126850006,21.0,Malignant tumor of anal canal (disorder),363352004,Neoplasm of anal canal (disorder)
371973000,125.0,Malignant tumor of cervix (disorder),363354003,Malignant neoplasm of uterus (disorder)
123841004,75.0,Malignant tumor of cervix (disorder),363354003,Neoplasm of uterine cervix (disorder)
126817006,94.0,Malignant tumor of esophagus (disorder),363402007,Neoplasm of esophagus (disorder)
255077007,692.0,Malignant tumor of esophagus (disorder),363402007,Malignant tumor of digestive organ (disorder)
428905002,337.0,Malignant tumor of esophagus (disorder),363402007,Malignant neoplasm of gastrointestinal tract (disorder)
126880001,84.0,Malignant tumor of kidney (disorder),363518003,Neoplasm of kidney (disorder)
363420003,135.0,Malignant tumor of kidney (disorder),363518003,Malignant retroperitoneal tumor (disorder)
448233000,114.0,Malignant tumor of kidney (disorder),363518003,Malignant neoplasm of urinary organ (disorder)
448882009,720.0,Malignant tumor of kidney (disorder),363518003,Malignant neoplasm of intraabdominal organ (disorder)
363489000,192.0,Malignant tumor of larynx (disorder),363429002,Malignant tumor of neck (disorder)
449066004,322.0,Malignant tumor of larynx (disorder),363429002,Malignant neoplasm of upper respiratory tract (disorder)
126692004,206.0,Malignant tumor of larynx (disorder),363429002,Neoplasm of larynx (disorder)
126713003,228.0,Malignant tumor of lung (disorder),363358000,Neoplasm of lung (disorder)
188361007,441.0,Malignant tumor of lung (disorder),363358000,Malignant neoplasm of thorax (disorder)
430621000,189.0,Malignant tumor of lung (disorder),363358000,Malignant neoplasm of lower respiratory tract (disorder)
363507003,183.0,Malignant tumor of nasopharynx (disorder),187692001,Malignant neoplasm of pharynx (disorder)
126680004,83.0,Malignant tumor of nasopharynx (disorder),187692001,Neoplasm of nasopharynx (disorder)
235075007,354.0,Malignant tumor of oral cavity (disorder),363505006,Tumor of oral cavity (disorder)
271323007,395.0,Malignant tumor of oral cavity (disorder),363505006,"Malignant neoplasm of lip, oral cavity and/or pharynx (disorder)"
448882009,720.0,Malignant tumor of ovary (disorder),363443007,Malignant neoplasm of intraabdominal organ (disorder)
363514001,226.0,Malignant tumor of ovary (disorder),363443007,Malignant tumor of female genital organ (disorder)
123843001,120.0,Malignant tumor of ovary (disorder),363443007,Neoplasm of ovary (disorder)
428322007,120.0,Malignant tumor of ovary (disorder),363443007,Malignant neoplasm of uterine adnexa (disorder)
448882009,720.0,Malignant tumor of pancreas (disorder),363418001,Malignant neoplasm of intraabdominal organ (disorder)
363420003,135.0,Malignant tumor of pancreas (disorder),363418001,Malignant retroperitoneal tumor (disorder)
255077007,692.0,Malignant tumor of pancreas (disorder),363418001,Malignant tumor of digestive organ (disorder)
126859007,115.0,Malignant tumor of pancreas (disorder),363418001,Neoplasm of pancreas (disorder)
363515000,111.0,Malignant tumor of prostate (disorder),399068003,Malignant tumor of male genital organ (disorder)
448882009,720.0,Malignant tumor of prostate (disorder),399068003,Malignant neoplasm of intraabdominal organ (disorder)
126906006,34.0,Malignant tumor of prostate (disorder),399068003,Neoplasm of prostate (disorder)
363484005,453.0,Malignant tumor of prostate (disorder),399068003,Malignant tumor of pelvis (disorder)
126847008,53.0,Malignant tumor of rectum (disorder),363351006,Neoplasm of rectum (disorder)
443488001,62.0,Malignant tumor of rectum (disorder),363351006,Malignant neoplasm of anorectum (disorder)
363484005,453.0,Malignant tumor of rectum (disorder),363351006,Malignant tumor of pelvis (disorder)
781382000,85.0,Malignant tumor of rectum (disorder),363351006,Malignant neoplasm of colon and/or rectum (disorder)
363508008,162.0,Malignant tumor of small intestine (disorder),363509000,Malignant tumor of intestine (disorder)
126832004,101.0,Malignant tumor of small intestine (disorder),363509000,Neoplasm of small intestine (disorder)
126824007,125.0,Malignant tumor of stomach (disorder),363349007,Neoplasm of stomach (disorder)
255077007,692.0,Malignant tumor of stomach (disorder),363349007,Malignant tumor of digestive organ (disorder)
448882009,720.0,Malignant tumor of stomach (disorder),363349007,Malignant neoplasm of intraabdominal organ (disorder)
428905002,337.0,Malignant tumor of stomach (disorder),363349007,Malignant neoplasm of gastrointestinal tract (disorder)
363515000,111.0,Malignant tumor of testis (disorder),363449006,Malignant tumor of male genital organ (disorder)
126900000,49.0,Malignant tumor of testis (disorder),363449006,Neoplasm of testis (disorder)
