conceptId,descendantCount,snomedConcept,snomedIdentifier,term
420675003,1.0,Progressive supranuclear palsy (disorder),192976002,Supranuclear gaze palsy (disorder)
16110005,32.0,Progressive supranuclear palsy (disorder),192976002,Ophthalmoplegia (disorder)
418143002,127.0,Progressive supranuclear palsy (disorder),192976002,Cerebral degeneration (disorder)
66091009,9373.0,Progressive supranuclear palsy (disorder),192976002,Congenital disease (disorder)
254956000,19.0,Prolactinoma (disorder),134209002,Pituitary adenoma (disorder)
448148000,6.0,Prolactinoma (disorder),134209002,Functioning pituitary neoplasm (disorder)
244938009,1261.0,Prolapse of female genital organs (disorder),73998008,Disorder of female genital organs (disorder)
30281009,101.0,Prostatitis (disorder),9713002,Disorder of prostate (disorder)
128478005,128.0,Prostatitis (disorder),9713002,Inflammatory disorder of male genital organ (disorder)
47458005,56.0,Prosthetic arthroplasty of the hip (procedure),397956004,Repair of hip joint (procedure)
398010007,40.0,Prosthetic arthroplasty of the hip (procedure),397956004,Insertion of hip prosthesis (procedure)
279333002,45.0,Pruritic rash (disorder),64144002,Pruritic disorder (disorder)
271807003,414.0,Pruritic rash (disorder),64144002,Eruption of skin (disorder)
10676911000119100,7.0,Pruritus ani (disorder),90446007,Pruritis of skin of anogenital region (disorder)
400037008,37.0,Pruritus ani (disorder),90446007,Disorder of perianal skin (disorder)
95320005,6832.0,Psoriasis (disorder),9014002,Disorder of skin (disorder)
426871003,88.0,Psoriasis (disorder),9014002,Cell-mediated cytotoxic disorder (disorder)
703938007,1123.0,Psoriatic arthritis (disorder),156370009,Inflammatory dermatosis (disorder)
724606001,12.0,Psoriatic arthritis (disorder),156370009,Peripheral spondyloarthritis (disorder)
9014002,87.0,Psoriatic arthritis (disorder),156370009,Psoriasis (disorder)
74732009,1930.0,Psychotic disorder (disorder),69322001,Mental disorder (disorder)
30473006,112.0,Pudendal neuralgia (disorder),427972000,Pain in pelvis (finding)
25416002,57.0,Pudendal neuralgia (disorder),427972000,Peripheral neuralgia (finding)
609626005,3736.0,Pudendal neuralgia (disorder),427972000,Finding of pelvis (finding)
719955006,15.0,Pulmonary atresia with intact ventricular septum (disorder),253590009,Atresia of pulmonary valve (disorder)
301867009,59.0,Pulmonary edema (disorder),19242006,Edema of trunk (disorder)
19829001,1148.0,Pulmonary edema (disorder),19242006,Disorder of lung (disorder)
312593004,72.0,Pulmonary embolism (disorder),59282003,Trunk arterial embolus (disorder)
39785005,359.0,Pulmonary embolism (disorder),59282003,Disorder of pulmonary circulation (disorder)
39785005,359.0,Pulmonary hypertension (disorder),70995007,Disorder of pulmonary circulation (disorder)
44241007,116.0,Pulmonic valve stenosis (disorder),56786000,Heart valve stenosis (disorder)
448643005,118.0,Pulmonic valve stenosis (disorder),56786000,Abnormality of pulmonary valve (disorder)
301105002,74.0,Pulmonic valve stenosis (disorder),56786000,Pulmonary valve lesion (finding)
55860008,15.0,Pyloric stenosis (disorder),367403001,Stenosis of stomach (disorder)
724834006,7.0,Pyoderma gangrenosum (disorder),74578003,Neutrophilic dermatosis (disorder)
721758001,12.0,Q fever (disorder),186788009,Infection caused by Coxiella (disorder)
3519007,215.0,Radial styloid tenosynovitis (disorder),21794005,Disorder of synovium (disorder)
363175000,1154.0,Radial styloid tenosynovitis (disorder),21794005,Inflammatory disorder of extremity (disorder)
118947000,5171.0,Radial styloid tenosynovitis (disorder),21794005,Disorder of upper extremity (disorder)
67801009,53.0,Radial styloid tenosynovitis (disorder),21794005,Tenosynovitis (disorder)
277132007,2191.0,Radiation oncology AND/OR radiotherapy (procedure),108290001,Therapeutic procedure (procedure)
85983004,160.0,Radiation sickness (disorder),370402009,Disorder caused by exposure to ionizing radiation (disorder)
422400008,63.0,Radiation sickness (disorder),370402009,Vomiting (disorder)
363679005,6502.0,Radiographic imaging procedure (procedure),363680008,Imaging (procedure)
363340006,520.0,Raynaud's disease (disorder),195295006,Vascular disorder of extremity (disorder)
473449006,1230.0,Raynaud's disease (disorder),195295006,Disease of non-coronary systemic artery (disorder)
396233005,79.0,Reactive arthritis (disorder),201736002,Arthropathy associated with infection (disorder)
239821006,144.0,Reactive arthritis (disorder),201736002,Secondary inflammatory arthritis (disorder)
724606001,12.0,Reactive arthritis (disorder),201736002,Peripheral spondyloarthritis (disorder)
129104009,517.0,Reactive attachment disorder (disorder),41526007,Developmental mental disorder (disorder)
239426007,8.0,Reconstruction of anterior cruciate ligament of knee joint (procedure),239431009,Repair of anterior cruciate ligament of knee joint (procedure)
449660006,70.0,Reconstruction of anterior cruciate ligament of knee joint (procedure),239431009,Reconstruction of lower limb (procedure)
450676000,5.0,Reconstruction of anterior cruciate ligament of knee joint (procedure),239431009,Reconstruction of intraarticular ligament (procedure)
12245007,6.0,Rectovaginal fistula (disorder),65619001,Intestinovaginal fistula (disorder)
80736008,25.0,Rectovaginal fistula (disorder),65619001,Rectal fistula (disorder)
703630003,5.0,Red eye (disorder),75705005,Red eye (finding)
62619007,3.0,Red eye (disorder),75705005,Ill-defined disorder of eye (disorder)
386637004,372.0,Removal of ectopic fetus (procedure),82688001,Obstetric procedure (procedure)
118292001,9991.0,Removal of ectopic fetus (procedure),82688001,Removal (procedure)
84744001,275.0,Repair of femoral hernia (procedure),238171002,Repair of hernia of abdominal wall (procedure)
119674005,105.0,Repair of femoral hernia (procedure),238171002,Thigh repair (procedure)
120205009,129.0,Repair of femoral hernia (procedure),238171002,Inguinal region repair (procedure)
84744001,275.0,Repair of inguinal hernia (procedure),44558001,Repair of hernia of abdominal wall (procedure)
120205009,129.0,Repair of inguinal hernia (procedure),44558001,Inguinal region repair (procedure)
274059009,54.0,Repair of tendon of hand (procedure),367430006,Hand tendon operation (procedure)
281760001,52.0,Repair of tendon of hand (procedure),367430006,Repair of tendon of upper limb (procedure)
119657005,194.0,Repair of tendon of hand (procedure),367430006,Hand repair (procedure)
45251002,76.0,Repair of umbilical hernia (procedure),44946007,Operation on umbilicus (procedure)
238192002,114.0,Repair of umbilical hernia (procedure),44946007,Repair of ventral hernia (procedure)
123946008,61674.0,Repetitive motion disorder (disorder),788465007,Disorder by body site (disorder)
279001004,927.0,Repetitive motion disorder (disorder),788465007,Pain finding at anatomical site (finding)
301857004,62914.0,Repetitive motion disorder (disorder),788465007,Finding of body region (finding)
373673007,327.0,Repetitive motion disorder (disorder),788465007,Disorder characterized by pain (disorder)
17849001,20.0,Respiratory distress syndrome in the newborn (disorder),46775006,Respiratory condition of fetus OR newborn (disorder)
34681009,8.0,Respiratory distress syndrome in the newborn (disorder),46775006,Perinatal respiratory distress (disorder)
19829001,1148.0,Respiratory distress syndrome in the newborn (disorder),46775006,Disorder of lung (disorder)
50043002,3544.0,Respiratory tract infection (disorder),275498002,Disorder of respiratory system (disorder)
301810000,4961.0,Respiratory tract infection (disorder),275498002,Infection by site (disorder)
84991000119105,9.0,Restless legs (disorder),32914008,Sleep related movement disorder (disorder)
118937003,5776.0,Restless legs (disorder),32914008,Disorder of lower extremity (disorder)
301905003,1531.0,Retinal detachment (disorder),42059000,Lesion of eye structure (finding)
29555009,1090.0,Retinal detachment (disorder),42059000,Retinal disorder (disorder)
11131000119108,3112.0,Retinal detachment (disorder),42059000,Anomaly of eye (disorder)
312771007,1173.0,Retinal disorder (disorder),29555009,Disorder of vitreous body and/or retina (disorder)
302893000,1248.0,Retinal disorder (disorder),29555009,Choroidal and/or chorioretinal disorder (disorder)
399858007,1213.0,Retinal disorder (disorder),29555009,Retina finding (finding)
37796009,35.0,Retinal migraine (disorder),79267007,Migraine (disorder)
81308009,3219.0,Retinal migraine (disorder),79267007,Disorder of brain (disorder)
255046005,164.0,Retinoblastoma (disorder),370967009,Neuroendocrine tumor (disorder)
735916009,1.0,Retinoblastoma (disorder),370967009,Primary malignant neuroepithelial neoplasm of retina (disorder)
127576008,29.0,Retinoblastoma (morphologic abnormality),19906005,"Malignant neuroendocrine neoplasm, neural (morphologic abnormality)"
115241005,41.0,Retinoblastoma (morphologic abnormality),19906005,Neuroepitheliomatous neoplasm (morphologic abnormality)
25093002,155.0,Retinopathy co-occurrent and due to diabetes mellitus (disorder),4855003,Disorder of eye due to diabetes mellitus (disorder)
29555009,1090.0,Retinopathy co-occurrent and due to diabetes mellitus (disorder),4855003,Retinal disorder (disorder)
110359009,397.0,Rett's disorder (disorder),68618008,Intellectual disability (disorder)
78689005,74.0,Rett's disorder (disorder),68618008,Chronic brain syndrome (disorder)
35919005,48.0,Rett's disorder (disorder),68618008,Pervasive developmental disorder (disorder)
128293007,95.0,Rett's disorder (disorder),68618008,Chronic mental disorder (disorder)
230226000,378.0,Rett's disorder (disorder),68618008,System disorder of the nervous system (disorder)
472916000,63.0,Reye's syndrome (disorder),74351001,Toxic metabolic encephalopathy (disorder)
302809008,19.0,Rheumatic fever (disorder),58718002,Streptococcus pyogenes infection (disorder)
123947004,72.0,Rheumatic fever (disorder),58718002,Post-streptococcal disorder (disorder)
3723001,724.0,Rheumatoid arthritis (disorder),69896004,Arthritis (disorder)
85828009,461.0,Rheumatoid arthritis (disorder),69896004,Autoimmune disease (disorder)
126533001,36.0,Rickets (disorder),41345002,Disorder with defective osteoid mineralization (disorder)
186771002,12.0,Rocky Mountain spotted fever (disorder),186772009,Spotted fever group rickettsial disease (disorder)
3441005,61.0,Rosacea (disorder),398909004,Disorder of sebaceous gland (disorder)
51490003,26.0,Rubella (disorder),36653000,Disease caused by Rubivirus (disorder)
72366004,37.0,Rumination disorder (disorder),37941009,Eating disorder (disorder)
735856007,14.0,Rupture of Achilles tendon (disorder),429513001,Injury of Achilles tendon (disorder)
281549008,32.0,Rupture of Achilles tendon (disorder),429513001,Rupture of tendon of lower limb (disorder)
128945009,119.0,Salmonella infection (disorder),302231008,Infection caused by Enterobacteriaceae (disorder)
118292001,9991.0,Sampling of chorionic villus (procedure),303720006,Removal (procedure)
118864003,617.0,Sampling of chorionic villus (procedure),303720006,Procedure on uterus (procedure)
128139000,8382.0,Sarcoidosis (disorder),31541009,Inflammatory disorder (disorder)
363346000,4337.0,Sarcoma (disorder),424413001,Malignant neoplastic disease (disorder)
86049000,886.0,"Sarcoma, no International Classification of Diseases for Oncology subtype (morphologic abnormality)",2424003,"Malignant neoplasm, primary (morphologic abnormality)"
372151005,113.0,"Sarcoma, no International Classification of Diseases for Oncology subtype (morphologic abnormality)",2424003,Sarcoma - category (morphologic abnormality)
64572001,78213.0,Scar (disorder),275322007,Disease (disorder)
280115004,171.0,Scar (morphologic abnormality),12402003,Acquired body structure (body structure)
107682006,123.0,Scar (morphologic abnormality),12402003,Fibrosis AND/OR repair abnormality (morphologic abnormality)
43591003,72.0,Scarlet fever (disorder),30242009,Exanthematous infectious disease (disorder)
302809008,19.0,Scarlet fever (disorder),30242009,Streptococcus pyogenes infection (disorder)
371310004,18.0,Scarlet fever (disorder),30242009,Streptococcal skin disorder (disorder)
69322001,160.0,Schizoaffective disorder (disorder),68890003,Psychotic disorder (disorder)
69322001,160.0,Schizophrenia (disorder),58214004,Psychotic disorder (disorder)
16805009,11.0,Schizotypal personality disorder (disorder),31027006,Cluster A personality disorder (disorder)
52585001,21.0,Sciatica (disorder),23056005,Sciatic neuropathy (disorder)
78514002,24.0,Sciatica (disorder),23056005,Thigh pain (finding)
373673007,327.0,Sciatica (disorder),23056005,Disorder characterized by pain (disorder)
25416002,57.0,Sciatica (disorder),23056005,Peripheral neuralgia (finding)
53619000,8129.0,Sclerosing mesenteritis (disorder),1092381000119100,Disorder of digestive system (disorder)
239953001,10765.0,Sclerosing mesenteritis (disorder),1092381000119100,Soft tissue lesion (disorder)
66579008,373.0,Sclerosing mesenteritis (disorder),1092381000119100,Disorder of peritoneum (disorder)
928000,11280.0,Scoliosis deformity of spine (disorder),298382003,Disorder of musculoskeletal system (disorder)
699699005,1370.0,Scoliosis deformity of spine (disorder),298382003,Disorder of vertebral column (disorder)
64217002,79.0,Scoliosis deformity of spine (disorder),298382003,Curvature of spine (disorder)
15886004,19.0,Screening for malignant neoplasm of breast (procedure),268547008,Screening for cancer (procedure)
191616006,31.0,Seasonal affective disorder (disorder),247803002,Recurrent depression (disorder)
128462008,771.0,Secondary malignant neoplasm of bone (disorder),94222008,Secondary malignant neoplastic disease (disorder)
428281000,256.0,Secondary malignant neoplasm of bone (disorder),94222008,Malignant neoplasm of bone (disorder)
94243009,21.0,Secondary malignant neoplasm of brain (disorder),94225005,Secondary malignant neoplasm of central nervous system (disorder)
428061005,98.0,Secondary malignant neoplasm of brain (disorder),94225005,Malignant neoplasm of brain (disorder)
94326009,147.0,Secondary malignant neoplasm of brain (disorder),94225005,Secondary malignant neoplasm of head (disorder)
299718000,3404.0,Seizure (finding),91175000,Finding of brain (finding)
313287004,428.0,Seizure (finding),91175000,Seizure related finding (finding)
80098002,3.0,Senile dementia of the Lewy body type (disorder),312991009,Diffuse Lewy body disease (disorder)
15662003,17.0,Senile dementia of the Lewy body type (disorder),312991009,Senile dementia (disorder)
414029004,1721.0,Sepsis (disorder),91302008,Disorder of immune function (disorder)
238147009,160.0,Sepsis (disorder),91302008,Organ dysfunction syndrome (disorder)
734548005,14.0,Serotonin reuptake inhibitor (disposition),763216009,Cellular transport inhibitor (disposition)
186747009,16.0,Severe acute respiratory syndrome (disorder),398447004,Coronavirus infection (disorder)
312133006,111.0,Severe acute respiratory syndrome (disorder),398447004,Viral respiratory infection (disorder)
84101006,147.0,Severe acute respiratory syndrome-related coronavirus (organism),415360003,Human coronavirus (organism)
868196001,142.0,Severe acute respiratory syndrome-related coronavirus (organism),415360003,Subgenus Sarbecovirus (organism)
59572000,4.0,Sheehan's syndrome (disorder),237684005,Necrosis of pituitary (disorder)
74728003,93.0,Sheehan's syndrome (disorder),237684005,Hypopituitarism (disorder)
51742006,133.0,Sheehan's syndrome (disorder),237684005,Disorder of anterior pituitary (disorder)
266732009,44.0,Shin splint (physical object),183202003,Orthosis for lower limb (physical object)
116308004,1102.0,Shoulder pain (finding),45326000,Finding of shoulder region (finding)
102556003,81.0,Shoulder pain (finding),45326000,Pain in upper limb (finding)
313413008,134.0,Sialolithiasis (disorder),28826002,Calculus finding (finding)
300257000,110.0,Sialolithiasis (disorder),28826002,Lesion of salivary gland (finding)
10890000,179.0,Sialolithiasis (disorder),28826002,Disorder of salivary gland (disorder)
37471005,34.0,Sick building syndrome (disorder),19076009,Extrinsic allergic alveolitis (disorder)
60423000,14.0,Sick sinus syndrome (disorder),36083008,Sinus node dysfunction (disorder)
417357006,30.0,Sickle cell-hemoglobin SS disease (disorder),127040003,Sickling disorder due to hemoglobin S (disorder)
14514008,77.0,Sickle cell-hemoglobin SS disease (disorder),127040003,Anemia due to disturbance of hemoglobin synthesis (disorder)
63565007,141.0,Sickle cell-hemoglobin SS disease (disorder),127040003,Congenital anemia (disorder)
123772008,9.0,Sickle cell-hemoglobin SS disease (disorder),127040003,Homozygous hemoglobinopathy (disorder)
323666000,37.0,Sickle cell-hemoglobin SS disease (disorder),127040003,Anemia due to intrinsic red cell abnormality (disorder)
424988008,76.0,Sickle cell-hemoglobin SS disease (disorder),127040003,Anemia caused by substance (disorder)
416417002,35.0,Sickling disorder due to hemoglobin S (disorder),417357006,Hereditary hemoglobin S (disorder)
69031006,104.0,Simple mastectomy (procedure),172043006,Excision of breast tissue (procedure)
386810004,46.0,Simple phobia (disorder),54587008,Phobic disorder (disorder)
301355003,8.0,Sinus headache (finding),4969004,Pain of respiratory structure (finding)
25064002,54.0,Sinus headache (finding),4969004,Headache (finding)
271745005,201.0,Sinus headache (finding),4969004,Facial sinus finding (finding)
363176004,2127.0,Sinusitis (disorder),36971009,Inflammatory disorder of head (disorder)
7393007,178.0,Sinusitis (disorder),36971009,Disorder of nasal sinus (disorder)
129134004,322.0,Sinusitis (disorder),36971009,Inflammatory disorder of upper respiratory tract (disorder)
363170005,8100.0,Sjgren's syndrome (disorder),83901003,Inflammation of specific body structures or tissue (disorder)
85828009,461.0,Sjgren's syndrome (disorder),83901003,Autoimmune disease (disorder)
81573002,46.0,Sjgren's syndrome (disorder),83901003,Collagen disease (disorder)
39898005,195.0,Sleep apnea (disorder),73430006,Sleep disorder (disorder)
50043002,3544.0,Sleep apnea (disorder),73430006,Disorder of respiratory system (disorder)
1023001,38.0,Sleep apnea (disorder),73430006,Apnea (finding)
58690002,43.0,Sleep paralysis (disorder),277180005,Parasomnia (disorder)
58690002,43.0,Sleep terror disorder (disorder),89675003,Parasomnia (disorder)
247962006,4.0,Sleep walking disorder (disorder),80495009,Sleep automatism (disorder)
270487001,6.0,Sleep walking disorder (disorder),80495009,Non-organic sleep disorder (disorder)
271794005,16.0,Sleep-wake schedule disorder due to jet lag (disorder),724751006,Disorder of sleep-wake cycle (disorder)
414015000,18.0,Smallpox (disorder),67924001,Disease caused by Orthopoxvirus (disorder)
276239002,1042.0,Smoking cessation therapy (regime/therapy),710081004,Therapy (regime/therapy)
106051002,87.0,Snoring (finding),72863001,Finding related to respiratory sounds (finding)
365852007,106.0,Snoring (finding),72863001,Respiratory function finding (finding)
386810004,46.0,Social phobia (disorder),25501002,Phobic disorder (disorder)
300373008,152.0,Soiling (finding),276484003,Finding of defecation (finding)
402165001,4.0,Solar erythema (disorder),403194002,Acute effect of ultraviolet radiation on normal skin (disorder)
399992009,86.0,Solar erythema (disorder),403194002,Erythroderma (disorder)
402624000,18.0,Solar lentigo (disorder),72100002,Lentiginosis (disorder)
399921006,178.0,Solar lentigo (disorder),72100002,Hamartoma of skin (disorder)
238513004,56.0,Solar lentigo (disorder),72100002,Ultraviolet-induced change in normal skin (disorder)
49765009,120.0,Solar lentigo (disorder),72100002,Hyperpigmentation of skin (disorder)
54609002,13.0,Solitary rectal ulcer syndrome (disorder),716685003,Ulcer of rectum (disorder)
43077002,2.0,Spermatocele (disorder),49263001,Cyst of epididymis (disorder)
11455007,8.0,Sphingomyelin/cholesterol lipidosis (disorder),58459009,Lipoidosis (disorder)
10741005,37.0,Sphingomyelin/cholesterol lipidosis (disorder),58459009,Lipid storage disease (disorder)
85995004,1554.0,Sphingomyelin/cholesterol lipidosis (disorder),58459009,Autosomal recessive hereditary disorder (disorder)
238028008,30.0,Sphingomyelin/cholesterol lipidosis (disorder),58459009,Sphingolipidosis (disorder)
409985002,230.0,Spider bite wound (disorder),403149008,Arthropod bite wound (disorder)
253098009,97.0,Spina bifida (disorder),67531005,Neural tube defect (disorder)
74877002,326.0,Spina bifida (disorder),67531005,Congenital anomaly of spine (disorder)
8447006,1756.0,Spina bifida (disorder),67531005,Congenital anomaly of skeletal bone (disorder)
699699005,1370.0,Spina bifida (disorder),67531005,Disorder of vertebral column (disorder)
298385001,737.0,Spina bifida (disorder),67531005,Finding of vertebra (finding)
262521009,434.0,Spinal cord injury (disorder),90584004,Traumatic injury of spinal cord and/or vertebral column (disorder)
48522003,890.0,Spinal cord injury (disorder),90584004,Spinal cord disorder (disorder)
128126004,763.0,Spinal cord injury (disorder),90584004,Injury of central nervous system (disorder)
84590007,32.0,Spinal muscular atrophy (disorder),5262007,Lower motor neuron disease (disorder)
49793008,31.0,Spinal muscular atrophy (disorder),5262007,Hereditary motor neuron disease (disorder)
410730009,2270.0,Spinal stenosis (disorder),76107001,Disorder of spinal region (disorder)
23426006,63.0,Spirometry (procedure),127783003,Measurement of respiratory function (procedure)
51244008,144.0,Splenomegaly (disorder),16294009,Disorder of spleen (disorder)
714254003,32.0,Splenomegaly (disorder),16294009,Abdominal organomegaly (disorder)
699699005,1370.0,Spondylolisthesis (disorder),274152003,Disorder of vertebral column (disorder)
76069003,5789.0,Spondylolisthesis (disorder),274152003,Disorder of bone (disorder)
37782003,555.0,Sprain (morphologic abnormality),384709000,Damage (morphologic abnormality)
201943001,11.0,Sprain of acromioclavicular ligament (disorder),27182002,Traumatic arthropathy of acromioclavicular joint (disorder)
123536004,57.0,Sprain of acromioclavicular ligament (disorder),27182002,Sprain of upper extremity (disorder)
125594001,349.0,Sprain of acromioclavicular ligament (disorder),27182002,Injury of shoulder region (disorder)
735903009,16.0,Sprain of acromioclavicular ligament (disorder),27182002,Sprain of ligament of trunk (disorder)
417746004,7653.0,Sprain of ligament (disorder),398878007,Traumatic injury (disorder)
263126002,380.0,Sprain of ligament (disorder),398878007,Ligament injury (disorder)
363346000,4337.0,Squamous cell carcinoma (disorder),402815007,Malignant neoplastic disease (disorder)
400066006,30.0,Squamous cell carcinoma in situ of skin (disorder),254656002,Intraepithelial squamous cell carcinoma (disorder)
92749008,82.0,Squamous cell carcinoma in situ of skin (disorder),254656002,Carcinoma in situ of skin (disorder)
252988009,24.0,"Squamous cell carcinoma, no International Classification of Diseases for Oncology subtype (morphologic abnormality)",28899001,"Malignant squamous tumor, primary (morphologic abnormality)"
182929008,53.0,Statin prophylaxis (procedure),315053001,Drug prophylaxis (procedure)
417174002,467.0,Steroid (substance),116566001,Polycyclic compound (substance)
473010000,2132.0,Stevens-Johnson syndrome (disorder),73442001,Hypersensitivity condition (finding)
768946000,8.0,Stevens-Johnson syndrome (disorder),73442001,"Stevens-Johnson syndrome, toxic epidermal necrolysis spectrum (disorder)"
105986008,582.0,Stickler syndrome (disorder),78675000,Congenital skeletal dysplasia (disorder)
232062002,7.0,Stickler syndrome (disorder),78675000,Hereditary vitreoretinopathy (disorder)
237513002,74.0,Stickler syndrome (disorder),78675000,Congenital anomaly of bone and joint (disorder)
253236002,8.0,Stickler syndrome (disorder),78675000,Congenital malformation of vitreous humor (disorder)
312225001,1650.0,Stickler syndrome (disorder),78675000,Musculoskeletal and connective tissue disorder (disorder)
363070008,1812.0,Stickler syndrome (disorder),78675000,Developmental hereditary disorder (disorder)
363212003,843.0,Stickler syndrome (disorder),78675000,Hereditary disorder of musculoskeletal system (disorder)
396275006,369.0,Stickler syndrome (disorder),78675000,Osteoarthritis (disorder)
82354003,975.0,Stickler syndrome (disorder),78675000,Multiple system malformation syndrome (disorder)
49381001,81.0,Stickler syndrome (disorder),78675000,Congenital anomaly of retina (disorder)
45030009,402.0,Strabismus (disorder),22066006,Disorder of eye movements (disorder)
312118003,59.0,Streptococcal sore throat (disorder),43878008,Bacterial upper respiratory infection (disorder)
85769006,136.0,Streptococcal sore throat (disorder),43878008,Streptococcal infectious disease (disorder)
312129004,298.0,Streptococcal sore throat (disorder),43878008,Bacterial infection of the digestive tract (disorder)
312422001,46.0,Streptococcal sore throat (disorder),43878008,Infective pharyngitis (disorder)
85769006,136.0,Streptococcus agalactiae infection (disorder),426933007,Streptococcal infectious disease (disorder)
125605004,2076.0,Stress fracture (disorder),240197007,Fracture of bone (disorder)
72704001,192.0,Stress fracture (morphologic abnormality),23382007,Fracture (morphologic abnormality)
289196009,24.0,Stuttering (finding),39423001,Finding of fluency of speech (finding)
450376009,62.0,Subarachnoid intracranial hemorrhage (disorder),21454007,Hemorrhage of intracranial meningeal space (disorder)
450362008,37.0,Subarachnoid intracranial hemorrhage (disorder),21454007,Hemorrhage into subarachnoid space of neuraxis (disorder)
21117005,7.0,Subconjunctival hemorrhage (disorder),78768009,Conjunctival hemorrhage (disorder)
450425005,23.0,Subdural intracranial hematoma (disorder),95453001,Intracranial hematoma (disorder)
449794003,14.0,Subdural intracranial hematoma (disorder),95453001,Hematoma of subdural space of neuraxis (disorder)
